{
  "schemaVersion": 1,
  "frameworkName": "ai-development-flow",
  "frameworkVersion": "1.0.0",
  "installMode": "vendored",
  "distributionDigest": "sha256:ae17c92679259e52d3dc2e9dfe4cf5c9ca5e752dbf0554480a83f99cf81335f8",
  "managedFiles": [
    {
      "path": "bin/ai-flow.mjs",
      "digest": "sha256:ddde974b1f8911e124a9707558e18a040b575dd4650d96b0d1faa5cd2d39e24a",
      "ownership": "framework",
      "source": "bin/ai-flow.mjs"
    },
    {
      "path": "package.json",
      "digest": "sha256:c3619b6ff1b1764f674df62e56f4266bb61d4e879eb20938bd5bc3619fdef34c",
      "ownership": "framework",
      "source": "package.json"
    },
    {
      "path": "schemas/authority-receipt.schema.json",
      "digest": "sha256:8536595574796a7c17cb47b5e1b92a14987e4445fb4fd260e49369499ca621dc",
      "ownership": "framework",
      "source": "schemas/authority-receipt.schema.json"
    },
    {
      "path": "schemas/baseline.schema.json",
      "digest": "sha256:bd20ae4dc483b7196754c8613f9bfb95bcaf9a37e729d4604a0773192174dd34",
      "ownership": "framework",
      "source": "schemas/baseline.schema.json"
    },
    {
      "path": "schemas/context-manifest.schema.json",
      "digest": "sha256:b9c7c3524013b109360855adc4ff93b4794dc987bdab333c56bec9b140db261d",
      "ownership": "framework",
      "source": "schemas/context-manifest.schema.json"
    },
    {
      "path": "schemas/decision-register.schema.json",
      "digest": "sha256:e1971b304982f64340623768d5b44a9b3251b7c65cddbbed46b18c8911dbfb70",
      "ownership": "framework",
      "source": "schemas/decision-register.schema.json"
    },
    {
      "path": "schemas/evidence-bundle.schema.json",
      "digest": "sha256:646d8d8c6463135019187b703fee5dfc1e3fd53ec786b29eef2c46fedeadf704",
      "ownership": "framework",
      "source": "schemas/evidence-bundle.schema.json"
    },
    {
      "path": "schemas/execution-authorization.schema.json",
      "digest": "sha256:7f5796b8f87bf80bf9e004230bd048d6de85e56c2a50eb5f922b5cd17be034fc",
      "ownership": "framework",
      "source": "schemas/execution-authorization.schema.json"
    },
    {
      "path": "schemas/framework-lock.schema.json",
      "digest": "sha256:ea4a2f65c79358cc677b259d457a96638cea7839e09c6a409ecd6671dfde86fa",
      "ownership": "framework",
      "source": "schemas/framework-lock.schema.json"
    },
    {
      "path": "schemas/impact-map.schema.json",
      "digest": "sha256:deb6ce1edf933424d3acee49ee1a25e3648d34bc96b853b029a738cec672f57f",
      "ownership": "framework",
      "source": "schemas/impact-map.schema.json"
    },
    {
      "path": "schemas/project-config.schema.json",
      "digest": "sha256:a115be3ad9f7461778f04ee88de5ad120c333c253f6ef49721628f627431407f",
      "ownership": "framework",
      "source": "schemas/project-config.schema.json"
    },
    {
      "path": "schemas/review-report.schema.json",
      "digest": "sha256:559b77f4d73ab7128d4ae5ca7ebbe6123d9800907efa59744e68be24603a0478",
      "ownership": "framework",
      "source": "schemas/review-report.schema.json"
    },
    {
      "path": "schemas/run-record.schema.json",
      "digest": "sha256:c755c90128deb5719d002c43e0a1db251a09a50dff30de60c8bb85e367b1a1b1",
      "ownership": "framework",
      "source": "schemas/run-record.schema.json"
    },
    {
      "path": "schemas/spec-index.schema.json",
      "digest": "sha256:d2d972e6c16ae5b347299a4712534d4078298a6b823713c335fde89670d26c28",
      "ownership": "framework",
      "source": "schemas/spec-index.schema.json"
    },
    {
      "path": "schemas/task-packet.schema.json",
      "digest": "sha256:76928231f64bc0765d3fde86a15ff51a7cd659f23fc0634f4e3cd4375408e226",
      "ownership": "framework",
      "source": "schemas/task-packet.schema.json"
    },
    {
      "path": "schemas/verification-result.schema.json",
      "digest": "sha256:83e4549dafd730805a4a706c077ccdc7aae72d7ef19f9a0454caa41c77857ba0",
      "ownership": "framework",
      "source": "schemas/verification-result.schema.json"
    },
    {
      "path": "schemas/verifier-registry.schema.json",
      "digest": "sha256:d374d4ac4c2eecca1a9959087b57f1ae02574cd268f50deaf7666a6cfec9be27",
      "ownership": "framework",
      "source": "schemas/verifier-registry.schema.json"
    },
    {
      "path": "src/cli/commands.mjs",
      "digest": "sha256:387c39f39e47e1c00c3bab8f54dd952a98d6fb09b2d05c18980aa77513a53352",
      "ownership": "framework",
      "source": "src/cli/commands.mjs"
    },
    {
      "path": "src/cli/constants.mjs",
      "digest": "sha256:4560274065f7f9ff6fb6c3a11b068e43e75a494133663cf594da9674dcb63d75",
      "ownership": "framework",
      "source": "src/cli/constants.mjs"
    },
    {
      "path": "src/cli/controller-commands.mjs",
      "digest": "sha256:bce611c796a67a1150293efb5bdd9eaa570131c60b11c8726223302029743c05",
      "ownership": "framework",
      "source": "src/cli/controller-commands.mjs"
    },
    {
      "path": "src/cli/digest.mjs",
      "digest": "sha256:4f7b631809f52866448235f36a42894f6dccd3be6efabbde1c5c75e39407a002",
      "ownership": "framework",
      "source": "src/cli/digest.mjs"
    },
    {
      "path": "src/cli/io.mjs",
      "digest": "sha256:f2e0a963ecf9cbf54206430482d8c311c87e44188f5eb99e3f47355abcf178f3",
      "ownership": "framework",
      "source": "src/cli/io.mjs"
    },
    {
      "path": "src/cli/main.mjs",
      "digest": "sha256:5e12cfb33875ad5d36f97f25b74bc99819ce635e16d89b067310e1b8ac5c89f9",
      "ownership": "framework",
      "source": "src/cli/main.mjs"
    },
    {
      "path": "src/cli/path-safety.mjs",
      "digest": "sha256:efc84250b71c97871c09ef95d46d7cb7dcddcc1d77a90289ba2b4a7e874ddf29",
      "ownership": "framework",
      "source": "src/cli/path-safety.mjs"
    },
    {
      "path": "src/cli/project-artifacts.mjs",
      "digest": "sha256:5400ae366a8008201f7a3c2bf4e5a695f7f7b9ee02cc1f9b6e3c4b3531486c3c",
      "ownership": "framework",
      "source": "src/cli/project-artifacts.mjs"
    },
    {
      "path": "src/cli/project-runtime.mjs",
      "digest": "sha256:783a3dbecbe867e456f085fc4fe7484af5761515257e29e9361b2b3ee8e2f2af",
      "ownership": "framework",
      "source": "src/cli/project-runtime.mjs"
    },
    {
      "path": "src/cli/project-state.mjs",
      "digest": "sha256:1763dcce330504efb637c80f25ceb2f741b589982f3bf770e0dcebb2781c7b41",
      "ownership": "framework",
      "source": "src/cli/project-state.mjs"
    },
    {
      "path": "src/cli/scaffold.mjs",
      "digest": "sha256:99174bb9f30190290faf0dd09d2989dd13e014a85792a94ab928e6cdf0977b15",
      "ownership": "framework",
      "source": "src/cli/scaffold.mjs"
    },
    {
      "path": "src/cli/self-check.mjs",
      "digest": "sha256:29e331cce97773d6ed8858187a689eb05d06b2aea6a650a434f11daff12c4ffe",
      "ownership": "framework",
      "source": "src/cli/self-check.mjs"
    },
    {
      "path": "src/cli/spec-adapter.mjs",
      "digest": "sha256:705ff2de20ef9cd6fd2e1744d81794734c067679e39bcf342d52f8b4af6849ef",
      "ownership": "framework",
      "source": "src/cli/spec-adapter.mjs"
    },
    {
      "path": "src/cli/start-command.mjs",
        "digest": "sha256:6c51eb0eeee906e010f8633624efc003dd171b5139df5fce3639015f1aaa659b",
      "ownership": "framework",
      "source": "src/cli/start-command.mjs"
    },
    {
      "path": "src/cli/static-commands.mjs",
      "digest": "sha256:65ad68df1e16a9b3a7a9cd1c7bb9703920476bd57ae1dd7e1e8450489ae82bf3",
      "ownership": "framework",
      "source": "src/cli/static-commands.mjs"
    },
    {
      "path": "src/cli/task-routing.mjs",
      "digest": "sha256:6654e9e2fed0c99861e9f660c74ed5da6cb5981bdb332d4e1afab535e4129c65",
      "ownership": "framework",
      "source": "src/cli/task-routing.mjs"
    },
    {
      "path": "src/cli/workflow-commands.mjs",
        "digest": "sha256:9c2f1e8c8025175615fc08d2e333ccd4a7513bc9980e12eea60af3021ab4abbe",
      "ownership": "framework",
      "source": "src/cli/workflow-commands.mjs"
    },
    {
      "path": "src/controller/active-control.mjs",
      "digest": "sha256:aec64128f9a5328e70951a5955c1348a6ff07a46349d15308e0fd79a9ce2fb16",
      "ownership": "framework",
      "source": "src/controller/active-control.mjs"
    },
    {
      "path": "src/controller/authorization.mjs",
      "digest": "sha256:8ea2cb66acca5a393eded0e0720186941caea2447c6491f98571c6aad617576b",
      "ownership": "framework",
      "source": "src/controller/authorization.mjs"
    },
    {
      "path": "src/controller/index.mjs",
      "digest": "sha256:e6e36fd3cd2f341e400d578a0e40bbb606e1444270f57d8e3cc89ec9695f6dc5",
      "ownership": "framework",
      "source": "src/controller/index.mjs"
    },
    {
      "path": "src/controller/instructions.mjs",
      "digest": "sha256:53c27cddfc7e989a21174fb7991d4ba3c3e5371983903a9a122b13ec0da0fc3a",
      "ownership": "framework",
      "source": "src/controller/instructions.mjs"
    },
    {
      "path": "src/controller/run-controller.mjs",
        "digest": "sha256:8ecf4e36df1058f3eee3aad49ef1a49e6a7b8ebfff608562dd36b4f34ebd2d1f",
      "ownership": "framework",
      "source": "src/controller/run-controller.mjs"
    },
    {
      "path": "src/core/asset-policy.mjs",
      "digest": "sha256:0689a3b862f3819870f7fae82ab35bace5ccd1ecff166d6a5b50429c1d55f4e7",
      "ownership": "framework",
      "source": "src/core/asset-policy.mjs"
    },
    {
      "path": "src/core/canonical.mjs",
      "digest": "sha256:02a0c2f21462f17096ff251bda967f0616f0372b5a41de6358ac217b5cd68b9c",
      "ownership": "framework",
      "source": "src/core/canonical.mjs"
    },
    {
      "path": "src/core/cycle.mjs",
      "digest": "sha256:da3585d6c500cd6eaec70048d126f51ff279d7f6c68cf655880e675595a23c77",
      "ownership": "framework",
      "source": "src/core/cycle.mjs"
    },
    {
      "path": "src/core/evidence.mjs",
      "digest": "sha256:2c96a75b0b7d15e9a77b2a1acf098ce346c3806fa780518f351f8850b202fb4b",
      "ownership": "framework",